{
  "$schema": "http://json-schema.org/draft-07/schema#",
  "title": "Rule Definition",
  "description": "Defines a single business rule for the automation engine.",
  "type": "object",
  "properties": {
    "id": { "type": "string", "description": "Unique identifier for the rule." },
    "name": { "type": "string", "description": "Human-readable name for the rule." },
    "description": { "type": "string", "description": "A more detailed description of what the rule does." },
    "category": {
      "type": "string",
      "enum": ["RENEWAL_REMINDER", "PAYMENT_REMINDER", "LEAD_ASSIGNMENT", "TASK_CREATION"]
    },
    "trigger": {
      "$ref": "trigger.schema.json"
    },
    "conditions": {
      "type": "array",
      "items": { "$ref": "condition.schema.json" }
    },
    "actions": {
      "type": "array",
      "items": { "$ref": "action.schema.json" }
    },
    "priority": { "type": "integer", "description": "Execution priority. Higher numbers are executed first." },
    "isEnabled": { "type": "boolean", "description": "Whether the rule is currently active." },
    "agencyId": { "type": "string", "description": "'global' or a specific agency ID." }
  },
  "required": ["id", "name", "category", "trigger", "conditions", "actions", "priority", "isEnabled"]
}