[
  {
    "id": "TC-001",
    "name": "Create Welcome Task for New Life Policies",
    "description": "When a new 'life' policy is created, assign a task to the agent to make a welcome call.",
    "category": "TASK_CREATION",
    "trigger": {
      "eventType": "POLICY_CREATED"
    },
    "conditions": [
      {
        "field": "policy.type",
        "operator": "EQUALS",
        "value": "life"
      }
    ],
    "actions": [
      {
        "actionType": "CREATE_TASK",
        "target": "AGENT",
        "template": "Make a welcome call to {customer.firstName} {customer.lastName} regarding their new life insurance policy ({policy.policyNumber})."
      }
    ],
    "priority": 50,
    "isEnabled": true,
    "agencyId": "global"
  }
]
