[
  {
    "id": "LA-001",
    "name": "Assign High-Value Leads to Senior Agent",
    "description": "Automatically assigns new leads with a potential value greater than â‚¬2000 to the senior agent.",
    "category": "LEAD_ASSIGNMENT",
    "trigger": {
      "eventType": "NEW_LEAD_CREATED"
    },
    "conditions": [
      {
        "field": "lead.potentialValue",
        "operator": "GREATER_THAN",
        "value": 2000
      }
    ],
    "actions": [
      {
        "actionType": "ASSIGN_LEAD",
        "target": "SYSTEM",
        "parameters": {
          "assignToAgentId": "user_1"
        }
      }
    ],
    "priority": 200,
    "isEnabled": true,
    "agencyId": "agency_1"
  }
]
